<?xml version="1.0" encoding="UTF-8"?>
<!DOCTYPE opencms SYSTEM "http://www.opencms.org/dtd/6.0/opencms-vfs.dtd">

<opencms>
    <vfs>
        <resources>
            <resourceloaders>
                <loader class="org.opencms.loader.CmsDumpLoader" />
                <loader class="org.opencms.loader.CmsImageLoader">
                    <param name="image.scaling.enabled">true</param>
                    <param name="image.scaling.concurrency">6</param>
                </loader>
                <loader class="org.opencms.loader.CmsPointerLoader" />
                <loader class="org.opencms.loader.CmsJspLoader">
                    <param name="taglib.cms">http://www.opencms.org/taglib/cms</param>
                    <param name="taglib.c">http://java.sun.com/jsp/jstl/core</param>
                    <param name="taglib.fn">http://java.sun.com/jsp/jstl/functions</param>
                    <param name="taglib.fmt">http://java.sun.com/jsp/jstl/fmt</param>
                    <param name="taglib.x">http://java.sun.com/jsp/jstl/xml</param>
                    <param name="taglib.sql">http://java.sun.com/jsp/jstl/sql</param>
                </loader>
                <loader class="org.opencms.loader.CmsXmlPageLoader" />
                <loader class="org.opencms.loader.CmsXmlContentLoader" />
                <loader class="org.opencms.loader.CmsXmlContainerPageLoader" />
                <loader class="org.opencms.loader.CmsRedirectLoader" />
                <loader class="org.opencms.loader.CmsSeoFileLoader" />
                <loader class="org.opencms.loader.CmsMacroFormatterLoader" />
            </resourceloaders>
            <resourcetypes>
                <type class="org.opencms.file.types.CmsResourceTypeUnknownFolder" name="unknown_folder" id="-2" />
                <type class="org.opencms.file.types.CmsResourceTypeUnknownFile" name="unknown_file" id="-1" />
                <type class="org.opencms.file.types.CmsResourceTypeFolder" name="folder" id="0">
                    <param name="restypes.indexpage">none|xmlpage|layoutpage</param>
                </type>
                <type class="org.opencms.file.types.CmsResourceTypePlain" name="plain" id="1">
                    <mappings>
                        <mapping suffix=".txt" />
                        <mapping suffix=".html" />
                        <mapping suffix=".htm" />
                        <mapping suffix=".java" />
                        <mapping suffix=".js" />
                        <mapping suffix=".xhtml" />
                        <mapping suffix=".txt" />
                        <mapping suffix=".xml" />
                        <mapping suffix=".xsd" />
                        <mapping suffix=".css" />
                        <mapping suffix=".map" />
                        <mapping suffix=".woff" />
                        <mapping suffix=".woff2" />
                        <mapping suffix=".eot" />
                        <mapping suffix=".otf" />
                        <mapping suffix=".ttc" />
                        <mapping suffix=".ttf" />
                        <mapping suffix=".csv" />
                    </mappings>
                    <param name="gallery.type.names">downloadgallery</param>
                </type>
                <type class="org.opencms.file.types.CmsResourceTypeBinary" name="binary" id="2">
                    <mappings>
                        <mapping suffix=".pdf" />
                        <mapping suffix=".zip" />
                        <mapping suffix=".7z" />
                        <mapping suffix=".class" />
                        <mapping suffix=".ppt" />
                        <mapping suffix=".doc" />
                        <mapping suffix=".docx" />
                        <mapping suffix=".xlsx" />
                        <mapping suffix=".pptx" />
                        <mapping suffix=".xls" />
                        <mapping suffix=".jar" />
                        <mapping suffix=".flv" />
                        <mapping suffix=".swf" />
                        <mapping suffix=".mp4" />
                        <mapping suffix=".ogv" />
                        <mapping suffix=".webm" />
                        <mapping suffix=".rar" />
                        <mapping suffix=".odt" />
                        <mapping suffix=".odp" />
                        <mapping suffix=".mp3" />
                        <mapping suffix=".m4a" />
                        <mapping suffix=".aac" />
                        <mapping suffix=".oga" />
                        <mapping suffix=".ogg" />
                        <mapping suffix=".m4v" />
                        <mapping suffix=".wmv" />
                        <mapping suffix=".mpeg" />
                        <mapping suffix=".mpg" />
                        <mapping suffix=".mov" />
                        <mapping suffix=".qt" />
                        <mapping suffix=".avi" />
                        <mapping suffix=".pkpass" />
                        <mapping suffix=".ai" />
                    </mappings>
                    <param name="gallery.type.names">downloadgallery</param>
                </type>
                <type class="org.opencms.file.types.CmsResourceTypeImage" name="image" id="3">
                    <mappings>
                        <mapping suffix=".jpeg" />
                        <mapping suffix=".jpg" />
                        <mapping suffix=".gif" />
                        <mapping suffix=".png" />
                        <mapping suffix=".tif" />
                        <mapping suffix=".tiff" />
                        <mapping suffix=".svg" />
                        <mapping suffix=".webp" />
                    </mappings>
                    <param name="gallery.type.names">imagegallery|downloadgallery</param>
                </type>
                <type class="org.opencms.file.types.CmsResourceTypeJsp" name="jsp" id="4">
                    <mappings>
                        <mapping suffix=".jsp" />
                    </mappings>
                    <properties>
                        <property>
                            <name>export</name>
                            <value type="shared"><![CDATA[false]]></value>
                        </property>
                    </properties>
                </type>
                <type class="org.opencms.file.types.CmsResourceTypePointer" name="pointer" id="5">
                    <param name="gallery.type.names">linkgallery</param>
                </type>
                <type class="org.opencms.file.types.CmsResourceTypeXmlContent" name="xmlcontent" id="7">
                    <param name="gallery.type.names">downloadgallery</param>
                </type>
                <type class="org.opencms.file.types.CmsResourceTypeFolderExtended" name="imagegallery" id="8">
                    <param name="folder.class">org.opencms.workplace.galleries.CmsAjaxImageGallery</param>
                    <param name="folder.class.params">w:120,h:90,c:D4D0C8,t:1,r:2</param>
                </type>
                <type class="org.opencms.file.types.CmsResourceTypeFolderExtended" name="downloadgallery" id="9">
                    <param name="folder.class">org.opencms.workplace.galleries.CmsAjaxDownloadGallery</param>
                </type>
                <type class="org.opencms.file.types.CmsResourceTypeFolderExtended" name="linkgallery" id="10">
                    <param name="folder.class">org.opencms.workplace.galleries.CmsAjaxLinkGallery</param>
                </type>
            </resourcetypes>
            <storage-policy class="org.opencms.db.storage.policy.CmsDefaultStoragePolicy" />
            <collectors>
                <collector class="org.opencms.file.collectors.CmsPriorityResourceCollector" order="100" />
                <collector class="org.opencms.file.collectors.CmsDefaultResourceCollector" order="110" />
                <collector class="org.opencms.file.collectors.CmsDateResourceCollector" order="120" />
                <collector class="org.opencms.file.collectors.CmsTimeFrameCategoryCollector" order="130" />
                <collector class="org.opencms.file.collectors.CmsCategoryResourceCollector" order="140" />
                <collector class="org.opencms.file.collectors.CmsSubscriptionCollector" order="150" />
                <collector class="org.opencms.file.collectors.CmsChangedResourceCollector" order="160" />
                <collector class="org.opencms.file.collectors.CmsSolrCollector" order="170" />
            </collectors>

            <mimetypes>

                <!--
                    # The basic list of mimetypes was taken from HTML 5 boilerplate project.
                    # See https://github.com/h5bp/server-configs/.
                    # Apparently the h5pb lists differ per server, this was taken from Nginx.
                    # Extensions have been added for office formats and Microsoft related files.
                -->

                <!-- Data interchange -->
                <mimetype extension=".atom" type="application/atom+xml" />
                <mimetype extension=".json" type="application/json" />
                <mimetype extension=".map" type="application/json" />
                <mimetype extension=".topojson" type="application/json" />
                <mimetype extension=".jsonld" type="application/ld+json" />
                <mimetype extension=".rss" type="application/rss+xml" />
                <mimetype extension=".geojson" type="application/vnd.geo+json" />
                <mimetype extension=".rdf" type="application/xml" />
                <mimetype extension=".xml" type="application/xml" />

                <!-- JavaScript -->
                <mimetype extension=".js" type="text/javascript" />
                <mimetype extension=".mjs" type="text/javascript" />
                <mimetype extension=".wasm" type="application/wasm" />

                <!-- Manifest files -->